user,twitters,truth,fake_score,emotion_score,emoji
d8y3v2kh07gdtlym8k8yjorulc6gua92,How To Tie A Tie 2019 Corpus Christi #URL# #URL#,0,0.12131884694099425,0.0,0
d8y3v2kh07gdtlym8k8yjorulc6gua92,How To Tie A Tie 4 Ways Little Rock #URL# #URL#,0,0.06532492488622665,0.0,0
d8y3v2kh07gdtlym8k8yjorulc6gua92,How To Draw A Dog House Step By Step Buffalo #URL# #URL#,0,0.08808653056621553,0.0,0
d8y3v2kh07gdtlym8k8yjorulc6gua92,How To Tie A Tie Picture Steps Lakewood #URL# #URL#,0,0.013763315044343472,0.0,0
d8y3v2kh07gdtlym8k8yjorulc6gua92,How 2 Tie A Tie Knot Fresno #URL# #URL#,0,0.11969989538192748,0.0,0
d8y3v2kh07gdtlym8k8yjorulc6gua92,How To Draw A Dog Doing The Dab Berkeley #URL# #URL#,0,0.017321202903985974,0.0,0
d8y3v2kh07gdtlym8k8yjorulc6gua92,How To Tie A Tie Harry Potter Sioux Falls #URL# #URL#,0,0.03324465826153755,0.0,0
d8y3v2kh07gdtlym8k8yjorulc6gua92,How To Tie A Tie A Shoe Tempe #URL# #URL#,0,0.043061651289463036,0.0,0
d8y3v2kh07gdtlym8k8yjorulc6gua92,How To Tie A Tie 3 Steps Worcester #URL# #URL#,0,0.04222595691680908,0.0,0
d8y3v2kh07gdtlym8k8yjorulc6gua92,How To Draw Anime On Ipad Davenport #URL# #URL#,0,0.012227790430188179,0.0,0
d8y3v2kh07gdtlym8k8yjorulc6gua92,Audi’s E-Tron becomes first electric car to win top safety award #URL# #URL#,0,0.30655786395072937,0.8979,0
d8y3v2kh07gdtlym8k8yjorulc6gua92,How 2 Draw Anime Cat Girl Stockton #URL# #URL#,0,0.020290035754442208,0.0,0
d8y3v2kh07gdtlym8k8yjorulc6gua92,Youtube How To Tie A Tie Fairfield #URL# #URL#,0,0.011389433406293392,0.0,0
d8y3v2kh07gdtlym8k8yjorulc6gua92,How To Draw Anime Pants Springfield #URL# #URL#,0,0.0134038170799613,0.0,0
d8y3v2kh07gdtlym8k8yjorulc6gua92,How To Draw A Dog Narrated Step By Step Torrance #URL# #URL#,0,0.035144831985235214,0.0,0
d8y3v2kh07gdtlym8k8yjorulc6gua92,How To Tie A Tie Right Handed Buffalo #URL# #URL#,0,0.0580361932516098,0.0,0
d8y3v2kh07gdtlym8k8yjorulc6gua92,How 2 Tie A Tie Cambridge #URL# #URL#,0,0.08964023739099503,0.0,0
d8y3v2kh07gdtlym8k8yjorulc6gua92,How To Draw A Dog Mouth Henderson #URL# #URL#,0,0.02600702457129956,0.0,0
d8y3v2kh07gdtlym8k8yjorulc6gua92,7 Ways To Tie A Tie Chicago #URL# #URL#,0,0.04509583488106728,0.0,0
d8y3v2kh07gdtlym8k8yjorulc6gua92,How to Draw a Cute Cuddle Team Leader from Fortnite #URL# #URL#,0,0.02099223062396049,0.4588,0
d8y3v2kh07gdtlym8k8yjorulc6gua92,How To Tie A Tie Up Shirt Akron #URL# #URL#,0,0.06986434012651442,0.0,0
d8y3v2kh07gdtlym8k8yjorulc6gua92,How To Draw A Dog Complex San Jose #URL# #URL#,0,0.05267738550901413,0.0,0
d8y3v2kh07gdtlym8k8yjorulc6gua92,How To Draw A Dog Yorkie Las Cruces #URL# #URL#,0,0.024242835119366646,0.0,0
d8y3v2kh07gdtlym8k8yjorulc6gua92,5 New Ways To Tie A Tie Wilmington #URL# #URL#,0,0.05315806344151497,0.0,0
d8y3v2kh07gdtlym8k8yjorulc6gua92,How To Draw A Dog That Looks Real Midland #URL# #URL#,0,0.028475500643253326,0.0,0
d8y3v2kh07gdtlym8k8yjorulc6gua92,How To Tie A Tie A Full Windsor Knot Akron #URL# #URL#,0,0.04913702607154846,0.0,0
d8y3v2kh07gdtlym8k8yjorulc6gua92,How To Tie A Tie Gentleman Irvine #URL# #URL#,0,0.04341862723231316,0.0,0
d8y3v2kh07gdtlym8k8yjorulc6gua92,How To Draw A Dog Colored Pencils Salt Lake City #URL# #URL#,0,0.03836826980113983,0.0,0
d8y3v2kh07gdtlym8k8yjorulc6gua92,How To Draw A Dog That Looks Real West Valley City #URL# #URL#,0,0.02492925152182579,0.0,0
d8y3v2kh07gdtlym8k8yjorulc6gua92,How To Draw A Dog Art Ala Carte New Haven #URL# #URL#,0,0.02671606279909611,0.0,0
d8y3v2kh07gdtlym8k8yjorulc6gua92,How To Tie A Tie Narrow Knot Aurora #URL# #URL#,0,0.03426210954785347,0.0,0
d8y3v2kh07gdtlym8k8yjorulc6gua92,How To Draw Anime Smile Wichita #URL# #URL#,0,0.013237887062132359,0.3612,0
d8y3v2kh07gdtlym8k8yjorulc6gua92,How To Draw A Dog Using The Word Dog Clovis #URL# #URL#,0,0.03619813919067383,0.0,0
d8y3v2kh07gdtlym8k8yjorulc6gua92,How To Draw A Dog With Circles Pasadena #URL# #URL#,0,0.04569496214389801,0.0,0
d8y3v2kh07gdtlym8k8yjorulc6gua92,How To Draw A Cartoon Dog Youtube Montgomery #URL# #URL#,0,0.016320398077368736,0.0,0
d8y3v2kh07gdtlym8k8yjorulc6gua92,How To Draw A Cartoon Dog Video Hillsboro #URL# #URL#,0,0.014203986153006554,0.0,0
d8y3v2kh07gdtlym8k8yjorulc6gua92,How To Draw A Dog And Cat Step By Step Carrollton #URL# #URL#,0,0.03561573848128319,0.0,0
d8y3v2kh07gdtlym8k8yjorulc6gua92,How To Tie A Tie Kid Sandy Springs #URL# #URL#,0,0.01732215099036694,0.0,0
d8y3v2kh07gdtlym8k8yjorulc6gua92,How To Draw A Dog Real Easy Allentown #URL# #URL#,0,0.03287376090884209,0.4404,0
d8y3v2kh07gdtlym8k8yjorulc6gua92,How To Tie A Tie In 2 Minutes Sunnyvale #URL# #URL#,0,0.032845787703990936,0.0,0
d8y3v2kh07gdtlym8k8yjorulc6gua92,How To Draw Anime Profile Atlanta #URL# #URL#,0,0.012140197679400444,0.0,0
d8y3v2kh07gdtlym8k8yjorulc6gua92,How To Tie A Tie 30 Ways Temecula #URL# #URL#,0,0.02661728672683239,0.0,0
d8y3v2kh07gdtlym8k8yjorulc6gua92,How To Tie A Tie To A Bow Tie Cambridge #URL# #URL#,0,0.02365035191178322,0.0,0
d8y3v2kh07gdtlym8k8yjorulc6gua92,How To Draw A Dog Collar Renton #URL# #URL#,0,0.014063884504139423,0.0,0
d8y3v2kh07gdtlym8k8yjorulc6gua92,How To Draw The Zodiac Dog Midland #URL# #URL#,0,0.030238248407840725,0.0,0
d8y3v2kh07gdtlym8k8yjorulc6gua92,How To Tie A Tie A Bandana Fairfield #URL# #URL#,0,0.09491043537855147,0.0,0
d8y3v2kh07gdtlym8k8yjorulc6gua92,How To Tie A Tie Quick Brownsville #URL# #URL#,0,0.03588447347283363,0.0,0
d8y3v2kh07gdtlym8k8yjorulc6gua92,How To Tie A Tie Rose Knot Vancouver #URL# #URL#,0,0.01801322214305401,0.0,0
d8y3v2kh07gdtlym8k8yjorulc6gua92,How To Draw A Dog Tail Oxnard #URL# #URL#,0,0.016922971233725548,0.0,0
d8y3v2kh07gdtlym8k8yjorulc6gua92,How To Tie A Bow Tie H&amp;m Syracuse #URL# #URL#,0,0.05272311717271805,0.0,0
d8y3v2kh07gdtlym8k8yjorulc6gua92,How To Draw A Dog From Behind Boulder #URL# #URL#,0,0.04487477242946625,0.0,0
d8y3v2kh07gdtlym8k8yjorulc6gua92,How To Tie A 2 Half Hitch Lexington #URL# #URL#,0,0.06607560813426971,0.0,0
d8y3v2kh07gdtlym8k8yjorulc6gua92,How To Draw Anime People San Jose #URL# #URL#,0,0.018502704799175262,0.0,0
gzbml73s00h3mlk2kdibc20o3rn2wd17,#USER#  I love your podcast! I hope you and speak on what went down on I love money 3. a lot of fans are dying to know,0,0.14655916392803192,0.9117,0
gzbml73s00h3mlk2kdibc20o3rn2wd17,RT #USER#: L.A. Country Coroner's Office says the bodies of all 9 people on board the helicopter have been recovered from the crash site http…,0,0.3631136119365692,-0.4019,0
gzbml73s00h3mlk2kdibc20o3rn2wd17,RT #USER#: Shakira opened the #HASHTAG# halftime show with a showstopping performance of her greatest hits. 🔥#URL#,0,0.08792567998170853,0.6369,1
gzbml73s00h3mlk2kdibc20o3rn2wd17,This is not a coincidence! I've been noticing  A LOT of similarities between Aaliyah and Billie Ellish #URL#,0,0.8392787575721741,0.0,0
gzbml73s00h3mlk2kdibc20o3rn2wd17,"RT #USER#: Shaq Can't Eat, Can't Sleep After Kobe Bryant's Death #URL#",0,0.0926731824874878,-0.5994,0
gzbml73s00h3mlk2kdibc20o3rn2wd17,RT #USER#: Valentine’s Day is over. Y’all can go back to hating each other again,0,0.23517826199531555,-0.5106,0
gzbml73s00h3mlk2kdibc20o3rn2wd17,I didn't know Chrissy Metz was a singer too?! #HASHTAG#,0,0.04380092769861221,0.0,0
gzbml73s00h3mlk2kdibc20o3rn2wd17,Bat Soup Girl Mukbanger~Accused of spreading Coronavirus As The Number O... #URL# via #USER#,0,0.6722968220710754,0.0772,0
gzbml73s00h3mlk2kdibc20o3rn2wd17,"RT #USER#: ""I feel like a very opportune moment in history is happening right now."" - #HASHTAG# producer Kwak Sin-ae accepts the first-ev…",0,0.1465548723936081,0.7778,0
gzbml73s00h3mlk2kdibc20o3rn2wd17,"Although you often find clarity amidst chaos, you won’t likely... More for Virgo #URL#",0,0.02504998818039894,-0.25,0
gzbml73s00h3mlk2kdibc20o3rn2wd17,RT #USER#: I’ve been sick in bed w/flu for 5days. My dr said they are asking people don’t go to ER and dr offices to avoid possible expos…,0,0.19246558845043185,-0.6705,0
gzbml73s00h3mlk2kdibc20o3rn2wd17,RT #USER#: Love is immortal. Love is infinite. 💔🏀🕊  🕊Our heartfelt condolences go out to the Bryant family &amp; to all the families affec…,0,0.20203663408756256,0.8957,4
gzbml73s00h3mlk2kdibc20o3rn2wd17,.#USER# #USER#  #USER# #USER#  #USER#  Megan from rock of love is finally on instagram  #URL#,0,0.0892157182097435,0.6369,0
gzbml73s00h3mlk2kdibc20o3rn2wd17,"RT #USER#: #USER# Well, that song won the first original song  Oscar that was hip hop.",0,0.154849573969841,0.7964,0
gzbml73s00h3mlk2kdibc20o3rn2wd17,"TX str!pper breaks jaw, sprains ankle &amp; chips teeth after falling from 1... #URL# via #USER#",0,0.9378880858421326,0.4451,0
gzbml73s00h3mlk2kdibc20o3rn2wd17,#USER# do what works best for you,0,0.08721025288105011,0.6369,0
gzbml73s00h3mlk2kdibc20o3rn2wd17,Hundreds of Americans evacuated from China as coronavirus infections inc... #URL# via #USER#,0,0.1963027119636536,0.0,0
gzbml73s00h3mlk2kdibc20o3rn2wd17,Your finely tuned intuition guides you to make brilliant decis... More for Virgo #URL#,0,0.0691780298948288,0.5859,0
gzbml73s00h3mlk2kdibc20o3rn2wd17,RT #USER#: The first 100 people to retweet will have a chance to get $800 I will start giving away 6 hrs from now so if you see t…,0,0.2091829478740692,0.5267,0
gzbml73s00h3mlk2kdibc20o3rn2wd17,People may see you as a veritable shelter in a storm. And the ... More for Virgo #URL#,0,0.03914247825741768,0.0,0
gzbml73s00h3mlk2kdibc20o3rn2wd17,Ok this whole situation with Caroline Flack. what we ere NOT going to do is all a sudden change the narrative when… #URL#,0,0.015657760202884674,0.29600000000000004,0
gzbml73s00h3mlk2kdibc20o3rn2wd17,RT #USER#: I’m so damn proud of Demi Lovato. A warrior.,0,0.2883794605731964,-0.0291,0
gzbml73s00h3mlk2kdibc20o3rn2wd17,I remember when Eminem won his Oscar for this song #HASHTAG#,0,0.2291674911975861,0.5719,0
gzbml73s00h3mlk2kdibc20o3rn2wd17,This  is Mashonda right now #HASHTAG# #URL#,0,0.12094590812921525,0.0,0
gzbml73s00h3mlk2kdibc20o3rn2wd17,"RT #USER#: Joaquin Phoenix just won his first-ever #HASHTAG# award for Best Actor for #HASHTAG#! To honor him, we’re throwing it back to 2007…",0,0.03438492864370346,0.9422,0
gzbml73s00h3mlk2kdibc20o3rn2wd17,You feel idealistic in your relationships today; it can be a m... More for Virgo #URL#,0,0.034410759806632996,0.4215,0
gzbml73s00h3mlk2kdibc20o3rn2wd17,"""and those who can't make their minds? oop was that shade billy?! #HASHTAG#",0,0.021050479263067245,0.0,0
gzbml73s00h3mlk2kdibc20o3rn2wd17,"You are in your own element, making good use of today’s Earth ... More for Virgo #URL#",0,0.046789251267910004,0.4404,0
gzbml73s00h3mlk2kdibc20o3rn2wd17,isn't weird that kobe Brayant exactly one week before the Superbowl?,0,0.0979987382888794,0.1326,0
gzbml73s00h3mlk2kdibc20o3rn2wd17,You have a chance for heart-warming and desirable interchanges... More for Virgo #URL#,0,0.06004532799124718,0.5106,0
gzbml73s00h3mlk2kdibc20o3rn2wd17,"""Sally's days are numbered"" Quinn those words are going to bite you in the ass #HASHTAG#",0,0.7108785510063171,-0.5423,0
gzbml73s00h3mlk2kdibc20o3rn2wd17,RT #USER#: Gayle King tried it. Kobe is not even in the ground. Nobody is thinking about what happened in 2003. Yes it's a blemish in…,0,0.14288298785686493,0.4019,0
gzbml73s00h3mlk2kdibc20o3rn2wd17,"RT #USER#: 1327 days ago, I lost my best friends to gun violence. I swore that I would never stop fighting for a world they’d be proud o…",0,0.4194697439670563,0.6806,0
gzbml73s00h3mlk2kdibc20o3rn2wd17,#USER# I'm also so glad you went in at Amanda Seales. i'm getting really tired of her,0,0.4916637241840362,0.1713,0
gzbml73s00h3mlk2kdibc20o3rn2wd17,"RT #USER#: Look, if you had another shot, another opportunity... Thanks for having me #USER#.  Sorry it took me 18 years to get here.…",0,0.15576171875,0.6597,0
gzbml73s00h3mlk2kdibc20o3rn2wd17,brad pitt finally won an oscar! #HASHTAG#,0,0.15088410675525665,0.6114,0
gzbml73s00h3mlk2kdibc20o3rn2wd17,"RT #USER#: Shannen Doherty, 48, reveals she has Stage IV cancer five years after being given the all-clear #URL#",0,0.21399737894535065,-0.6597,0
gzbml73s00h3mlk2kdibc20o3rn2wd17,I find it really funny these talk shows like #USER# #USER# #USER# #USER#  are barely talking the tap… #URL#,0,0.07754582911729813,0.6901,0
gzbml73s00h3mlk2kdibc20o3rn2wd17,"RT #USER#: Wtf kinda issues do Gayle King and Oprah have involving black men? Smfh Gayles interview with Lisa Leslie was tasteless,…",0,0.7411907315254211,-0.5859,0
gzbml73s00h3mlk2kdibc20o3rn2wd17,RT #USER#: .#USER# called out a concert-goer who kept harassing her by screaming G-Eazy’s name at her. #HASHTAG# #URL#…,0,0.2118796557188034,-0.7269,0
gzbml73s00h3mlk2kdibc20o3rn2wd17,"Partnering in a business venture could prove to be lucrative, ... More for Virgo #URL#",0,0.06636223196983337,0.0,0
gzbml73s00h3mlk2kdibc20o3rn2wd17,RT #USER#: I’ve put a lot of thought into this. I want to start an original Pageant for all drag no mater your gender/non gender a…,0,0.2026849091053009,-0.128,0
gzbml73s00h3mlk2kdibc20o3rn2wd17,RT #USER#: Britney Spears and Jessica Simpson 😔 This level of nostalgia hurts my heart. Take me back to pop culture 😭 #URL#…,0,0.2889695167541504,-0.7096,2
gzbml73s00h3mlk2kdibc20o3rn2wd17,"RT #USER#: Most Streamed ""90s Bubblegum Pop Stars"" on Spotify! 1.  #USER# :9.1M 2. #USER# :8.7M  3. #USER# :2M 4. #USER#…",0,0.050280697643756866,0.0,0
gzbml73s00h3mlk2kdibc20o3rn2wd17,"Amanda Seales Defends Jussie Smollett: Even If Attack Was a ‘Hoax,’ It W... #URL# via #USER#",0,0.3779032826423645,-0.4767,0
gzbml73s00h3mlk2kdibc20o3rn2wd17,The turtle is Jesse mccartney! I recognize his voice #HASHTAG#,0,0.4332046508789063,0.0,0
gzbml73s00h3mlk2kdibc20o3rn2wd17,"RT #USER#: I was trying to be composed and glamorous, but really I was just so excited and blown away by the heart and authenticit…",0,0.14556215703487396,0.7449,0
gzbml73s00h3mlk2kdibc20o3rn2wd17,Muting this racist performing right now #HASHTAG#,0,0.5207101106643677,-0.6124,0
gzbml73s00h3mlk2kdibc20o3rn2wd17,Now you got OJ Simpson murdering ass coming for Gayle King too? sit your ass down!,0,0.8908902406692505,-0.9117,0
gzbml73s00h3mlk2kdibc20o3rn2wd17,RT #USER#: My coworker named his son Kobe. 😩😩.,0,0.06788250803947449,-0.4939,2
gzbml73s00h3mlk2kdibc20o3rn2wd17,RT #USER#: I’m a little sad Joan Rivers didn’t live long enough to have a meltdown about how she doesn’t get Billie Eilish.,0,0.20385774970054624,-0.4228,0
gzbml73s00h3mlk2kdibc20o3rn2wd17,this is why I watch the Oscars. expect the unexpected #HASHTAG#,0,0.02465568482875824,0.0,0
gzbml73s00h3mlk2kdibc20o3rn2wd17,"RT #USER#: Please do not support TheSun, DailyMirror &amp; any other trash media. Don’t click their sites &amp; do not buy their newspapers.…",0,0.2377007007598877,0.0108,0
gzbml73s00h3mlk2kdibc20o3rn2wd17,Jumping to conclusions can send you down a rabbit hole of unce... More for Virgo #URL#,0,0.146882101893425,0.0,0
gzbml73s00h3mlk2kdibc20o3rn2wd17,RT #USER#: The good thing about gaining some weight is that bitch my ass and thighs look right! But bish if I keep drinking this b…,0,0.06804794818162918,-0.2714,0
gzbml73s00h3mlk2kdibc20o3rn2wd17,Look at all these pathetic Selena Gomez stans hating on demi Lovato SB performance.  we know who the real talented… #URL#,0,0.8752011656761169,-0.7906,0
gzbml73s00h3mlk2kdibc20o3rn2wd17,"RT #USER#: Christina Mauser, an assistant girls basketball coach at Harbor Day School in Del Mar, Ca. passed away on the helicopter…",0,0.1869779825210572,0.0,0
gzbml73s00h3mlk2kdibc20o3rn2wd17,"First fergie butchers the Star Bangled Banner, now Chaka Khan?",0,0.9277937412261964,0.0,0
gzbml73s00h3mlk2kdibc20o3rn2wd17,OMG Eminem performing 8 mile's lose yourself! That was my shit! #HASHTAG#,0,0.23312272131443024,-0.7835,0
gzbml73s00h3mlk2kdibc20o3rn2wd17,You can get a lot done now with the Moon moving into versatile... More for Virgo #URL#,0,0.08506905287504196,0.0,0
gzbml73s00h3mlk2kdibc20o3rn2wd17,RT #USER#: #USER# #USER# How sad! The Mother punished her daughter to get even with the Dad! What's even worse...arguing in t…,0,0.20238196849823,-0.7707,0
gzbml73s00h3mlk2kdibc20o3rn2wd17,the turtle is Jesse McCartney! #HASHTAG#,0,0.2260279506444931,0.0,0
gzbml73s00h3mlk2kdibc20o3rn2wd17,This is why i did not throw an Trump impeachment party like some  ya'll did,0,0.9483394026756288,0.6369,0
gzbml73s00h3mlk2kdibc20o3rn2wd17,"RT #USER#: Caroline Flack kills herself and everyone says it's a tragedy which it is, Megan Markle clears off and everyone talks shit a…",0,0.20376038551330566,-0.9042,0
gzbml73s00h3mlk2kdibc20o3rn2wd17,You'll feel a strong pull to withdraw and tap into your imagin... More for Virgo #URL#,0,0.03238126263022423,0.5106,0
gzbml73s00h3mlk2kdibc20o3rn2wd17,RT #USER#: .#USER# is the youngest artist in #HASHTAG# history to sweep the Big 4 categories in one year.,0,0.03229902312159538,0.0,0
gzbml73s00h3mlk2kdibc20o3rn2wd17,This is a day for connection and creativity. You want to be fr... More for Virgo #URL#,0,0.010450666770339012,0.4404,0
gzbml73s00h3mlk2kdibc20o3rn2wd17,Billie Eillish why the fuck do i keep winning? #HASHTAG#,0,0.5040141344070435,-0.0258,0
gzbml73s00h3mlk2kdibc20o3rn2wd17,You would make the most of your time today by relaxing and sta... More for Virgo #URL#,0,0.034653324633836746,0.4939,0
gzbml73s00h3mlk2kdibc20o3rn2wd17,Parasite is the first non english movie to win Best Picture! wow! #HASHTAG#,0,0.07472574710845947,0.9244,0
gzbml73s00h3mlk2kdibc20o3rn2wd17,Bitter baby mama cuts her daughter's braids to piss off her BD!~Don't no... #URL# via #USER#,0,0.8185639977455139,-0.7901,0
gzbml73s00h3mlk2kdibc20o3rn2wd17,It’s a bewildering day as slippery Neptune makes a tense squar... More for Virgo #URL#,0,0.6686044335365295,-0.34,0
gzbml73s00h3mlk2kdibc20o3rn2wd17,Your desire to make loved ones happy shouldn’t undermine your ... More for Virgo #URL#,0,0.03286022320389748,0.8442,0
gzbml73s00h3mlk2kdibc20o3rn2wd17,#USER# she has oifficially lost it,0,0.2180215120315552,-0.3182,0
gzbml73s00h3mlk2kdibc20o3rn2wd17,"RT #USER#: Anyway, someone let me know when the halftime show is about to start.",0,0.30867165327072144,0.0,0
gzbml73s00h3mlk2kdibc20o3rn2wd17,#USER# She blocked me years ago,0,0.36675795912742615,-0.2732,0
gzbml73s00h3mlk2kdibc20o3rn2wd17,"Snoop Dogg Apologizes to Gayle King~ I'M SORRY, GAYLE  For Overreacting!... #URL# via #USER#",0,0.6317296624183655,0.1923,0
gzbml73s00h3mlk2kdibc20o3rn2wd17,"You have a strong inclination to work in solitude, quietly att... More for Virgo #URL#",0,0.01834971643984317,0.5106,0
gzbml73s00h3mlk2kdibc20o3rn2wd17,"Your worldview is being stretched thin and tested today, and i... More for Virgo #URL#",0,0.03920005261898042,0.0,0
gzbml73s00h3mlk2kdibc20o3rn2wd17,You’re drawn to mysteries today as Venus moves into your 8th H... More for Virgo #URL#,0,0.3945782780647278,0.0,0
gzbml73s00h3mlk2kdibc20o3rn2wd17,I never really cared for Valentines Day.Why should you have day to show how much you love somebody? You should be d… #URL#,0,0.1590428650379181,0.3922,0
gzbml73s00h3mlk2kdibc20o3rn2wd17,You want this evening’s entertainment to be eye-opening and th... More for Virgo #URL#,0,0.02420058287680149,0.4767,0
gzbml73s00h3mlk2kdibc20o3rn2wd17,You may experience a deep sense of relief today. You might be ... More for Virgo #URL#,0,0.014305878430604938,0.4767,0
gzbml73s00h3mlk2kdibc20o3rn2wd17,RT #USER#: I’m sorry but all of the white GOP men clapping and cheering and chanting is giving me major “The Purge: Election Year…,0,0.7465087175369263,0.8126,0
gzbml73s00h3mlk2kdibc20o3rn2wd17,Mukbang Binge Eater Nikocado Avocado Laughs And Disrespects Kobe Bryant ... #URL# via #USER#,0,0.4337558448314667,0.4939,0
gzbml73s00h3mlk2kdibc20o3rn2wd17,"RT #USER#: We're on day 5 of Black History Month and we got Gayle, Meek, and Nicki acting up",0,0.24190130829811096,0.0,0
gzbml73s00h3mlk2kdibc20o3rn2wd17,OMG that is shia labouf?! #HASHTAG#,0,0.30824014544487,0.0,0
gzbml73s00h3mlk2kdibc20o3rn2wd17,They all standing up and clapping like he is hitler.. i can't #HASHTAG#,0,0.6214438080787659,0.3612,0
gzbml73s00h3mlk2kdibc20o3rn2wd17,#USER# he won an Oscar for that song. the movie was not a flop,0,0.09669329971075058,0.6943,0
gzbml73s00h3mlk2kdibc20o3rn2wd17,#USER# yes he was still impeached by he was acquitted on all charges by the Senate just now. He's still in the white house,0,0.9239826798439026,0.3818,0
gzbml73s00h3mlk2kdibc20o3rn2wd17,RT #USER#: Shannen Doherty Reveals Stage 4 Cancer Diagnosis #URL#,0,0.3278805613517761,-0.6597,0
gzbml73s00h3mlk2kdibc20o3rn2wd17,"RT #USER#: Kirk Douglas, Hollywood legend and star of Spartacus, dies aged 103 #URL#",0,0.1718696355819702,0.0,0
gzbml73s00h3mlk2kdibc20o3rn2wd17,Nicki Minaj Accuses Meek Mill of Abu$e Meek goes off: You PAID for Broth... #URL# via #USER#,0,0.8243300914764404,-0.34,0
gzbml73s00h3mlk2kdibc20o3rn2wd17,RT #USER#: She doing exactly what Lady Gaga told her NOT TO DO 😭  #HASHTAG#,0,0.3262708783149719,-0.4767,1
gzbml73s00h3mlk2kdibc20o3rn2wd17,You are bemused by your relationships today as your best frien... More for Virgo #URL#,0,0.05186799913644791,0.6369,0
gzbml73s00h3mlk2kdibc20o3rn2wd17,Gayle King Shifts The Blame ON CBS After Getting Drug On Social Media Fo... #URL# via #USER#,0,0.6722133159637451,-0.34,0
gzbml73s00h3mlk2kdibc20o3rn2wd17,Activity is directed toward the home front today -- your famil... More for Virgo #URL#,0,0.6573876142501831,0.0,0
gzbml73s00h3mlk2kdibc20o3rn2wd17,Rapper Mase calls out Diddy~ You're A HYPOCRITE let me buy my publishing... #URL# via #USER#,0,0.9372828006744384,0.0,0
gzbml73s00h3mlk2kdibc20o3rn2wd17,#USER# OMG! I was obsessed with those!,0,0.07941656559705734,-0.3147,0
gzbml73s00h3mlk2kdibc20o3rn2wd17,a South Korean movie just won Best Picture! #HASHTAG#,0,0.06318085640668869,0.8478,0
iyamqcg0w2b7n2ukim49aerg3bumyxh4,#USER# yes be on the show.,1,0.11351854354143145,0.4019,0
iyamqcg0w2b7n2ukim49aerg3bumyxh4,#USER# yeah greg is going to block the door. want her to look at his face when he kisses me.,1,0.5845353007316589,0.4404,0
iyamqcg0w2b7n2ukim49aerg3bumyxh4,#USER# never seen a girl that doesnt wear under shirt. i  wear one under my school blouse,1,0.2058937847614289,0.0,0
iyamqcg0w2b7n2ukim49aerg3bumyxh4,#USER# while cam going to be wearing givenchy.,1,0.1535506695508957,0.0,0
iyamqcg0w2b7n2ukim49aerg3bumyxh4,#USER# ciji has a shape. ciji doesnt have a boyish body. move on she doesnt want you and youre mad about it. dont date actors.,1,0.12908412516117096,-0.5302,0
iyamqcg0w2b7n2ukim49aerg3bumyxh4,#USER# only if you guys come meet. only if  khloe ciara kim kylie kendall olivia sees my face.,1,0.2870495617389679,0.0,0
iyamqcg0w2b7n2ukim49aerg3bumyxh4,#USER# ciji is going to do chores by helping her mommy in the kitchen. ciji is a seapup. move on ben thank you thank you thank you,1,0.06073403358459473,0.8271,0
iyamqcg0w2b7n2ukim49aerg3bumyxh4,#USER# forgot im roasting some frogs. having a boiling pot. seafood boil chicken pig feet potatoes turkey necks. corn,1,0.0410657525062561,0.0,0
iyamqcg0w2b7n2ukim49aerg3bumyxh4,#USER# dont think we are going to see yourself on say yes to the dress. get your dead mo to sow you a dress.,1,0.7108704447746277,-0.3818,0
iyamqcg0w2b7n2ukim49aerg3bumyxh4,#USER# yes im a pup. my body not changing for nobody. ben needs to worry about his bust open pee hole. his dick don't even work.,1,0.1800840198993683,-0.5423,0
iyamqcg0w2b7n2ukim49aerg3bumyxh4,#USER# cam need to air his dick out and get his head straight.,1,0.8158106207847595,-0.34,0
iyamqcg0w2b7n2ukim49aerg3bumyxh4,#USER# ciji going to pull out all of her teeth lay it out where the bed suppose to go at robert's house. shes not staying w you!!!,1,0.21364977955818176,0.0,0
iyamqcg0w2b7n2ukim49aerg3bumyxh4,#USER# yall going to watch the video. say something positive. she got good grades. she speaks so well. she speaks several languages,1,0.10573266446590424,0.8497,0
iyamqcg0w2b7n2ukim49aerg3bumyxh4,#USER# i know my parents john and traci is giving me tlc. how you ask? we go to the fairs and state fairs. have a great time.,1,0.6169388890266418,0.7579,0
iyamqcg0w2b7n2ukim49aerg3bumyxh4,#USER# cam would take kia and that little girl to a fair. all would be doing is walking around the whole fair the whole time.,1,0.3475153148174286,-0.1531,0
iyamqcg0w2b7n2ukim49aerg3bumyxh4,#USER# im going to post it too. talk sports net. but let me shoot this marvel global initiative video w misss unionjack'd first.,1,0.1547403633594513,0.3127,0
iyamqcg0w2b7n2ukim49aerg3bumyxh4,#USER# unicorn onsie when i go trick or treating.yes participate ciji. be on the show..,1,0.13446924090385434,-0.0516,0
iyamqcg0w2b7n2ukim49aerg3bumyxh4,#USER# kia cecil the dead mo wouldnt even hold his degree in their hands. they wouldnt do it. but they came for the cake.,1,0.5183055996894836,-0.6428,0
iyamqcg0w2b7n2ukim49aerg3bumyxh4,#USER# yeah 3 guys. whose the 3rd old guy. see you when im 15 in two yrs. cam robert and i are enemies.,1,0.33900806307792664,-0.25,0
iyamqcg0w2b7n2ukim49aerg3bumyxh4,#USER# he didnt kiss kia during chosen whatever.,1,0.07620948553085327,0.2584,0
iyamqcg0w2b7n2ukim49aerg3bumyxh4,#USER# ben is a joke ciji would be a jester if she takes ben seriously so will I. Know you get it that in fact I'm on Ciji side.,1,0.9040662050247192,0.128,0
iyamqcg0w2b7n2ukim49aerg3bumyxh4,#USER# i was raise in the projects. we all had a draw full of under shirts. thats a damn shame.,1,0.15306460857391355,-0.7003,0
iyamqcg0w2b7n2ukim49aerg3bumyxh4,#USER# even if kia had her own money he still wouldnt aloow them to buy food or drink. maybe share a drink. they just content.,1,0.06966943293809891,-0.4588,0
iyamqcg0w2b7n2ukim49aerg3bumyxh4,#USER# going to the library to read some stories w the kids. got to shoot a video w my uncle joe about assualt. hear my story,1,0.053798068314790726,-0.34,0
iyamqcg0w2b7n2ukim49aerg3bumyxh4,#USER# one problem after another. when i threw glass at you.,1,0.140165776014328,-0.4019,0
